0;Sem isenção;Sem isenção
EXP;Mercadoria para Exportação;Alinea a) do nº1 do art.14º do Dec.Lei nº394-13/84
FORM;Prestações de Serviços de Formação Profissional;nº10 do art.9º do CIVA
REI;Regime Especial de Isenção;Artigo 53º do CIVA
REIS;Regime Especial de Isenção (Saúde);Artigo 9º do CIVA
REPR;Regime Especial dos Pequenos Retalhistas;Artigo 60º do CIVA
TGB;Transmissões Gratuitas de Bens (amostras/ofertas);nº7 do art.3º do CIVA
IPSS;Transmissões Gratuitas de Bens (IPSS);nº10 do art.15º do CIVA